{
  "schema_version": 1,
  "diff_id": "knowledge-diff-wiki-layout-v2",
  "owner_delivery_id": "prd-wiki-layout-v2",
  "knowledge_baseline": "knowledge-revision-42",
  "operations": [
    {
      "kind": "REWRITE",
      "fact_id": "fact-wiki-layout-model",
      "owner_domain_id": "wiki-workspace",
      "evidence_refs": [
        "test-report-wiki-layout-v2"
      ]
    }
  ],
  "domain_changes": [],
  "entry_points": [
    "client/desktop/src/wiki/WikiWorkspace.kt"
  ],
  "evidence_refs": [
    "test-report-wiki-layout-v2"
  ],
  "remaining_limits": [],
  "outcome": "CHANGE"
}
